Event_Name,CharacterImageSerialNumber,케릭터 이름,대사,선택지가 있는가?,선택지 대사,선택후 대사,변경할 배경 번호,주사위를 굴리는가?,주사위 대사,주사위 종류,대상 스탯,이벤트 후 대사,어떤 리셋인가?,아이템 번호,다음 장면,서브화면
Example,0,,당신은 끝내 시간 내에 전기를 연결하지 못했다.     ,,,,,,,,,,,,,
,0,,유형화 된 어둠이 당신을 잡아 삼킨다.,,,,,,,,,,,,,
,0,,당신은 두려움을 이기지 못한다. 어디에 있지? 어디로 간거지? 당신의 앞으로 다가오던 그것은 어느샌가 보이지 않는다.,,,,,,,,,,,,,
,0,,"아니, 사실 아무것도 보이지 않는다.",,,,,,,,,,,,,
,0,,조금이라도 반짝이던 전기패널도 당신의 광원도 모든 것이 보이지 않는다.,,,,,,,,,,,,,
,0,,그러다 당신은 문득 목 뒤에 소름이 돋는 것을 느낀다. 뒤에 있다.,,,,,,,,,,,,,
,0,,당신은 본능적으로 그것이 뒤에 있음을 느낀다. 절망한다. 그리고…[으적],,,,,,,,,,,,,
,0,,바닥에는 알 수 없는 액체가 추가되고@ 패널은 아무 일 없다는 깜빡이다 불이 들어올 뿐이었다. 다음 먹잇감을 기다리듯이......,,,,,,,,,,1,,,
end,,,,,,,,,,,,,,,,